[
  {
    "product_id": "watch001",
    "name": "Умные часы SmartWatch Pro",
    "description": "Премиум умные часы с AMOLED дисплеем, мониторингом здоровья и GPS",
    "price": {"amount": 15999.00, "currency": "RUB"},
    "category": "Умные часы",
    "brand": "TechWatch",
    "stock": {"available": 45, "reserved": 5},
    "sku": "TW-WATCH001",
    "tags": ["умные часы", "фитнес", "gps", "amoled"],
    "images": [{"url": "https://example.com/watch1.jpg", "alt": "SmartWatch Pro"}],
    "specifications": {"weight": "42g", "battery_life": "7 days", "water_resistance": "5ATM"},
    "created_at": "2024-01-15T10:00:00Z",
    "updated_at": "2024-10-20T12:00:00Z",
    "index": "products",
    "store_id": "store_001"
  },
  {
    "product_id": "watch002",
    "name": "Спортивные часы FitTracker Elite",
    "description": "Часы для спортсменов с GPS и пульсометром",
    "price": {"amount": 8999.00, "currency": "RUB"},
    "category": "Умные часы",
    "brand": "FitGear",
    "stock": {"available": 120, "reserved": 10},
    "sku": "FG-WATCH002",
    "tags": ["часы", "спорт", "фитнес", "gps"],
    "images": [{"url": "https://example.com/watch2.jpg", "alt": "FitTracker Elite"}],
    "specifications": {"weight": "38g", "battery_life": "14 days", "water_resistance": "10ATM"},
    "created_at": "2024-02-10T11:00:00Z",
    "updated_at": "2024-10-21T09:00:00Z",
    "index": "products",
    "store_id": "store_001"
  },
  {
    "product_id": "watch003",
    "name": "Классические умные часы TimeStyle",
    "description": "Элегантные часы с умными функциями для повседневного использования",
    "price": {"amount": 12500.00, "currency": "RUB"},
    "category": "Умные часы",
    "brand": "TimeStyle",
    "stock": {"available": 65, "reserved": 8},
    "sku": "TS-WATCH003",
    "tags": ["часы", "классика", "стиль", "умные"],
    "images": [{"url": "https://example.com/watch3.jpg", "alt": "TimeStyle Watch"}],
    "specifications": {"weight": "55g", "battery_life": "5 days", "water_resistance": "3ATM"},
    "created_at": "2024-03-05T14:30:00Z",
    "updated_at": "2024-10-22T10:15:00Z",
    "index": "products",
    "store_id": "store_001"
  },
  {
    "product_id": "watch004",
    "name": "Детские умные часы KidWatch",
    "description": "Безопасные часы для детей с GPS трекером и SOS кнопкой",
    "price": {"amount": 4999.00, "currency": "RUB"},
    "category": "Умные часы",
    "brand": "KidTech",
    "stock": {"available": 200, "reserved": 25},
    "sku": "KT-WATCH004",
    "tags": ["детские часы", "gps", "безопасность"],
    "images": [{"url": "https://example.com/watch4.jpg", "alt": "KidWatch"}],
    "specifications": {"weight": "30g", "battery_life": "3 days", "water_resistance": "IP67"},
    "created_at": "2024-04-12T09:00:00Z",
    "updated_at": "2024-10-23T11:30:00Z",
    "index": "products",
    "store_id": "store_001"
  },
  {
    "product_id": "watch005",
    "name": "Гибридные часы HybridTime",
    "description": "Классический дизайн с умными уведомлениями",
    "price": {"amount": 9999.00, "currency": "RUB"},
    "category": "Умные часы",
    "brand": "HybridTech",
    "stock": {"available": 80, "reserved": 12},
    "sku": "HT-WATCH005",
    "tags": ["гибридные часы", "стиль", "уведомления"],
    "images": [{"url": "https://example.com/watch5.jpg", "alt": "HybridTime"}],
    "specifications": {"weight": "65g", "battery_life": "30 days", "water_resistance": "5ATM"},
    "created_at": "2024-05-18T13:45:00Z",
    "updated_at": "2024-10-24T08:20:00Z",
    "index": "products",
    "store_id": "store_001"
  },
  {
    "product_id": "headphone001",
    "name": "Беспроводные наушники AirSound Pro",
    "description": "Premium TWS наушники с активным шумоподавлением ANC",
    "price": {"amount": 12999.00, "currency": "RUB"},
    "category": "Наушники",
    "brand": "AirSound",
    "stock": {"available": 150, "reserved": 20},
    "sku": "AS-HP001",
    "tags": ["наушники", "беспроводные", "anc", "tws"],
    "images": [{"url": "https://example.com/headphone1.jpg", "alt": "AirSound Pro"}],
    "specifications": {"weight": "50g", "battery_life": "8 hours", "connectivity": "Bluetooth 5.2"},
    "created_at": "2024-01-20T10:00:00Z",
    "updated_at": "2024-10-20T14:00:00Z",
    "index": "products",
    "store_id": "store_001"
  },
  {
    "product_id": "headphone002",
    "name": "Игровая гарнитура GameSound RGB",
    "description": "Проводная гарнитура с объемным звуком 7.1 и RGB подсветкой",
    "price": {"amount": 5999.00, "currency": "RUB"},
    "category": "Наушники",
    "brand": "GameTech",
    "stock": {"available": 95, "reserved": 15},
    "sku": "GT-HP002",
    "tags": ["гарнитура", "игровые", "rgb", "микрофон"],
    "images": [{"url": "https://example.com/headphone2.jpg", "alt": "GameSound RGB"}],
    "specifications": {"weight": "320g", "connectivity": "USB", "surround": "7.1"},
    "created_at": "2024-02-14T11:30:00Z",
    "updated_at": "2024-10-21T15:00:00Z",
    "index": "products",
    "store_id": "store_001"
  },
  {
    "product_id": "headphone003",
    "name": "Спортивные наушники SportBuds",
    "description": "Влагозащищенные TWS наушники для тренировок",
    "price": {"amount": 3999.00, "currency": "RUB"},
    "category": "Наушники",
    "brand": "SportAudio",
    "stock": {"available": 180, "reserved": 22},
    "sku": "SA-HP003",
    "tags": ["наушники", "спорт", "влагозащита", "tws"],
    "images": [{"url": "https://example.com/headphone3.jpg", "alt": "SportBuds"}],
    "specifications": {"weight": "40g", "battery_life": "6 hours", "water_resistance": "IPX7"},
    "created_at": "2024-03-08T09:15:00Z",
    "updated_at": "2024-10-22T13:30:00Z",
    "index": "products",
    "store_id": "store_001"
  },
  {
    "product_id": "headphone004",
    "name": "Накладные наушники StudioPro",
    "description": "Профессиональные студийные наушники с Hi-Res звуком",
    "price": {"amount": 18999.00, "currency": "RUB"},
    "category": "Наушники",
    "brand": "StudioSound",
    "stock": {"available": 45, "reserved": 8},
    "sku": "SS-HP004",
    "tags": ["наушники", "студийные", "hi-res", "профессиональные"],
    "images": [{"url": "https://example.com/headphone4.jpg", "alt": "StudioPro"}],
    "specifications": {"weight": "280g", "impedance": "32 Ohm", "frequency": "5Hz-40kHz"},
    "created_at": "2024-04-22T14:00:00Z",
    "updated_at": "2024-10-23T16:45:00Z",
    "index": "products",
    "store_id": "store_001"
  },
  {
    "product_id": "headphone005",
    "name": "Детские наушники KidSound",
    "description": "Безопасные наушники с ограничением громкости для детей",
    "price": {"amount": 1999.00, "currency": "RUB"},
    "category": "Наушники",
    "brand": "KidAudio",
    "stock": {"available": 250, "reserved": 30},
    "sku": "KA-HP005",
    "tags": ["наушники", "детские", "безопасность"],
    "images": [{"url": "https://example.com/headphone5.jpg", "alt": "KidSound"}],
    "specifications": {"weight": "180g", "max_volume": "85dB", "connectivity": "3.5mm jack"},
    "created_at": "2024-05-30T10:30:00Z",
    "updated_at": "2024-10-24T12:00:00Z",
    "index": "products",
    "store_id": "store_001"
  },
  {
    "product_id": "keyboard001",
    "name": "Механическая клавиатура MechPro RGB",
    "description": "Полноразмерная механическая клавиатура с переключателями Cherry MX",
    "price": {"amount": 9999.00, "currency": "RUB"},
    "category": "Клавиатуры",
    "brand": "MechTech",
    "stock": {"available": 75, "reserved": 12},
    "sku": "MT-KB001",
    "tags": ["клавиатура", "механическая", "rgb", "cherry mx"],
    "images": [{"url": "https://example.com/keyboard1.jpg", "alt": "MechPro RGB"}],
    "specifications": {"switch_type": "Cherry MX Red", "layout": "Full-size", "connectivity": "USB-C"},
    "created_at": "2024-01-25T11:00:00Z",
    "updated_at": "2024-10-20T15:30:00Z",
    "index": "products",
    "store_id": "store_001"
  },
  {
    "product_id": "keyboard002",
    "name": "Беспроводная клавиатура SlimKey",
    "description": "Тонкая беспроводная клавиатура для офиса",
    "price": {"amount": 2999.00, "currency": "RUB"},
    "category": "Клавиатуры",
    "brand": "SlimTech",
    "stock": {"available": 200, "reserved": 25},
    "sku": "ST-KB002",
    "tags": ["клавиатура", "беспроводная", "офис", "тонкая"],
    "images": [{"url": "https://example.com/keyboard2.jpg", "alt": "SlimKey"}],
    "specifications": {"connectivity": "Bluetooth 5.0", "battery_life": "6 months", "layout": "Compact"},
    "created_at": "2024-02-18T12:30:00Z",
    "updated_at": "2024-10-21T16:00:00Z",
    "index": "products",
    "store_id": "store_001"
  },
  {
    "product_id": "keyboard003",
    "name": "Игровая клавиатура GameKey Elite",
    "description": "Клавиатура для геймеров с оптомеханическими переключателями",
    "price": {"amount": 7999.00, "currency": "RUB"},
    "category": "Клавиатуры",
    "brand": "GamePro",
    "stock": {"available": 110, "reserved": 18},
    "sku": "GP-KB003",
    "tags": ["клавиатура", "игровая", "rgb", "оптомеханическая"],
    "images": [{"url": "https://example.com/keyboard3.jpg", "alt": "GameKey Elite"}],
    "specifications": {"switch_type": "Optical-Mechanical", "response_time": "0.2ms", "connectivity": "USB"},
    "created_at": "2024-03-12T13:45:00Z",
    "updated_at": "2024-10-22T14:20:00Z",
    "index": "products",
    "store_id": "store_001"
  },
  {
    "product_id": "keyboard004",
    "name": "Компактная клавиатура Mini60",
    "description": "60% механическая клавиатура для минималистов",
    "price": {"amount": 5999.00, "currency": "RUB"},
    "category": "Клавиатуры",
    "brand": "MiniTech",
    "stock": {"available": 85, "reserved": 10},
    "sku": "MT-KB004",
    "tags": ["клавиатура", "компактная", "60%", "механическая"],
    "images": [{"url": "https://example.com/keyboard4.jpg", "alt": "Mini60"}],
    "specifications": {"layout": "60%", "switch_type": "Gateron", "hot_swap": "Yes"},
    "created_at": "2024-04-05T15:00:00Z",
    "updated_at": "2024-10-23T17:30:00Z",